{
  "schema_version": "1.0.0",
  "request_id": "request.conflict",
  "status": "conflict",
  "files_written": [],
  "preserved_files": [{ "path": "src/custom/workbench.ts", "ownership": "custom", "sha256": "sha256:bbbbbbbbbbbbbbbbbbbbbbbbbbbbbbbbbbbbbbbbbbbbbbbbbbbbbbbbbbbbbbbb" }],
  "diagnostic_ids": ["diagnostic.custom-conflict"],
  "staging_cleanup_completed": true,
  "atomic_commit_completed": false,
  "rollback_attempted": false,
  "rollback_completed": false,
  "target_unchanged": true,
  "result_checksum": "sha256:cccccccccccccccccccccccccccccccccccccccccccccccccccccccccccccccc"
}
