{
  "schema_version": "1.0.0",
  "request_id": "request.demo",
  "status": "succeeded",
  "files_written": [{ "path": "src/generated/account.ts", "ownership": "generated", "sha256": "sha256:aaaaaaaaaaaaaaaaaaaaaaaaaaaaaaaaaaaaaaaaaaaaaaaaaaaaaaaaaaaaaaaa", "action": "created" }],
  "preserved_files": [{ "path": "src/custom/workbench.ts", "ownership": "custom", "sha256": "sha256:bbbbbbbbbbbbbbbbbbbbbbbbbbbbbbbbbbbbbbbbbbbbbbbbbbbbbbbbbbbbbbbb" }],
  "diagnostic_ids": [],
  "staging_cleanup_completed": true,
  "atomic_commit_completed": true,
  "rollback_attempted": false,
  "rollback_completed": false,
  "target_unchanged": false,
  "rollback_point_path": "artifacts/rollback/request-demo.json",
  "commit_journal_path": "artifacts/journal/request-demo.json",
  "assembly_manifest_path": "artifacts/assembly-manifest.json",
  "generated_lock_path": "artifacts/generated-project-lock.json",
  "result_checksum": "sha256:cccccccccccccccccccccccccccccccccccccccccccccccccccccccccccccccc"
}
